Company/Brand,HeadQuarter,Sector,What it does,Amount($),Funding Year
Clairvolex,California,Tech Startup,Clairvolex is an IP solutions company that manages IP assets of large corporations using an IPAM model.,2000000.0,2020
Assiduus,Bangalore,E-commerce,"Assiduus leverages its eCommerce experience to help build, grow and scale your brand on various eCommerce platforms",1000000.0,2020
Brinton,California,HealthTech,Brinton is one of the fastest growing Pharmaceutical Companies spreading its network worldwide.,1300000.0,2020
AFK Gaming,Mumbai,Entertainment,AFK Gaming is a media and entertainment and gaming company located in Mumbai.,200000.0,2020
Infarm,Berlin,AgriTech,Infarm builds and distributes highly efficient vertical farms throughout cities to grow fresh produce right in your neighbourhood.,170000000.0,2020
Zuper,Seattle,SaaS startup,Zuper is a productivity suite for service businesses to mobile field workforce and automate all business operations.,1100000.0,2020
mCaffeine,Mumbai,Personal care startup,"MCaffeine is a personal care brand that offers caffein-infused face, body, and hair care products.",2900000.0,2020
Origa,Andheri,FinTech,The charioteer of your growth at all times.,2000000.0,2020
GullyBuy Software,Pune,Tech Startup,To deliver a solution that will provide shopping convenience to every consumer in India,543000.0,2020
Recordent,Hyderabad,FinTech,A technology-enabled platform that helps MSMEs to increase their business efficiency through collection of dues,1.0,2020
MPL,Bangalore,Entertainment,Mobile Premier League is the mobile e-Sports platform based in India.,90000000.0,2020
Penny,Riyadh,SaaS startup,Offer various development solutions and mainly focus on helping startups,1300000.0,2020
Onsitego,Mumbai,Customer service company,Onsitego is a customer service company for device and appliance repairs.,30000000.0,2020
Precily,California,SaaS  startup,Precily is Artificial Intelligence platform for enterprises that increases efficiency of workforce by providing AI based solutions.,1.0,2020
SmartClean,Singapore,Tech Startup,SmartClean Technologies is an AI company that offers data-driven cleaning operations designed for facilities.,3400000.0,2020
ClanConnect,Delhi,Marketing startup,"AI-driven influencer marketing platform ClanConnect.ai, which helps brands make their campaigns more data and result-oriented",600000.0,2020
Servify,Mumbai,Service industry,Servify is a self-learning platform that provides device management services and warranty solutions.,23000000.0,2020
ShareChat,Bangalore,Social media,ShareChat is a social networking and regional content platform.,40000000.0,2020
Rephrase.ai,Bangalore,AI,Rephrase.ai helps in creating high-quality videos and animations through an AI-powered visual dubbing tool.,1500000.0,2020
Melorra,Bangalore,Jewellery,"Buy Latest Gold, Diamond & Gemstone Jewellery Designs Online Rings, Earrings, Necklace",8090000.0,2020
FabHotels,Gurgaon,Hospitality,FabHotels is a network of 3 star budget hotels in India,1030000.0,2020
EkAnek,Delhi,Tech Startup,EkAnek Networks is a new startup that is focused on building the ecosystem for new age brands in lifestyle categories,5040000.0,2020
Cub McPaws,Mumbai,AR startup,Cub McPaws is a kids clothing brand.,800000.0,2020
Zimyo,Gurgaon,HR Tech startup,Employee experience platform that empowers organizations to manage and retain great talent!,1500000.0,2020
PumPumPum,Gurgaon,Automotive Startup,Pumpumpum is a car rental company,360000.0,2020
Burgerama,Gurgaon,Food Startup,Burgerama is a unit of Junket Foods Private Limited,1.0,2020
Moms Co,Gurgaon,HealthCare,The Moms Co. creates a safe and natural formulated products for babies that are certified toxin-free,8000000.0,2020
DillyHub,Seoul,Publication,A service that promotes and facilitates the works of independent comic artists,1400000.0,2020
FPL Technologies,Pune,FinTech,FPL is on a mission to re-imagine credit and payments from first principles and is building a mobile-first credit card,10000000.0,2020
FITTR,Pune,Fitness startup,Fitness Social Network & Consultation Platform that helps you achieve your Health & Fitness goals.,2000000.0,2020
Illumnus,Pune,EdTech Startup,"An innovative EdTech startup from IITB & BITS alumni, offering B2B SaaS-based collaborative LMS for Schools and Universities",100000.0,2020
CashKaro,Gurgaon,E-commerce,Cashkaro is a coupons and cashback site rewarding customers for visiting online retailers through their site.,10000000.0,2020
Newton School,Bangalore,EdTech Startup,Newton School is a platform to learn and develop skills,650000.0,2020
Airmeet,Bangalore,Tech Startup,"Airmeet is an all-in-one events platform for virtual summits, meetups, and workshops that includes virtual social lounge",12000000.0,2020
Observe ai,San Francisco,Tech,"Observe.AI develops a voice AI platform for contact centers, turning agents into top performers.",54000000.0,2020
InCred,Mumbai,Finance,"Provide loans for all your needs like personal loan for wedding, education loan, business loan",5000000.0,2020
Toppr,Mumbai,EdTech,Toppr is an Indian educational technology and online tutoring firm,35000000.0,2020
CarTrade,Mumbai,Car Trade,Buy and Sell Used Cars,42500000.0,2020
LEAD School,Mumbai,EdtTech,Offers a high-end digital classroom system focused on enhancing the learning experience,28000000.0,2020
Servify,Mumbai,Manufacturing,"Enables top OEMs & ODMs in device distribution, sales, warranty",11370000.0,2020
Lido Learning,Mumbai,EdTech,"Online classes for Std 4-9 in Math, Science, Coding, English & Leadership with top 1% tutors ‍",7500000.0,2020
Apna.co,Bangalore,Job portal,Can find all types of jobs from entry level to experienced people in over 60+ categories.,8000000.0,2020
Quintype Technologies,Bangalore,Tech,"Building a suite of digital publishing solutions to simplify content creation, distribution",325000.0,2020
Dunzo,Bangalore,Tech,Order online and get free delivery from your nearby restaurants,28000000.0,2020
Entropik,Bangalore,AI Platform,Gain insights into human emotions with AI-powered platform affect lab.,8000000.0,2020
Livspace,Bangalore,Home Design,Interior design marketplace that connects interior designers,9000000.0,2020
Ultraviolette Automotive,Bangalore,Automation,Industries Automotive Electric Vehicle Energy Energy Storage,410000.0,2020
WinZO,Delhi,Gaming,WinZO is a mobile e-Sports gaming platform in India. It is available in 10 regional languages of India.,18000000.0,2020
SenseHawk,Bangalore,Solar SaaS,SenseHawk is a SaaS platform that helps improve processes and saves cost in the development,5000000.0,2020
Railofy,Mumbai,WL & RAC protection,Enables waitlisted passengers to reach their destination at the lowest possible price if their ticket is not,900000.0,2020
Eloelo,Bangalore,Social commerce,"Social Commerce Venture for Wellness. View company info, jobs, team members, culture, funding and more.",450000.0,2020
Aibono,Bangalore,AgriTech,A next dimension food & farming platform that unites two ends of the food chain from growing to consuming,2000000.0,2020
BuildPan,Indore,SaaS startup,"Buildpan helps you with continuous build, development and user feedback for iOS and Android development.",500000.0,2020
Homelane,Bangalore,Home interior services,Explore 1000's of fully customizable home interior designs.,8000000.0,2020
MyGlamm,Mumbai,Fashion,Buy Makeup kit & Cosmetics Products from international makeup brand,1000000.0,2020
Aviom,Delhi,Finance,A social impact focused housing finance company catering to housing needs of customers in semi urban areas,682000.0,2020
Flinto,Chennai,EdTech Startup,Flintobox is an India-based company that produces educational activity boxes for children,7000000.0,2020
WayCool,Chennai,Agritech startup,WayCool is a social enterprise positively impacting the lives of India's farmers,5060000.0,2020
YAP,Chennai,API platform,Create your own stream of Neo-banking and Deposit products using our bank-grade APIs,4050000.0,2020
Big Bang Boom Solutions,Chennai,Deep Tech,It aims to co-create intellectual property that can reside within the borders of the country.,1050000.0,2020
GUVI,Chennai,EdTech Startup,Operates vernacular-language based education tech startup,800000.0,2020
BluSmart,Gurgaon,Electricity,"BluSmart, an all-electric ride-hailing platform",7000000.0,2020
Cell Propulsion,Bangalore,Automotive company,Designs and develops electric power drives and autonomous electric mobility solutions,1.0,2020
MPL,Bangalore,Entertainment,Mobile Premier League (also known as MPL) is the mobile e-Sports platform,50000000.0,2020
Spoonshot,Bangalore,FMCG,A food science company using AI to predict consumer taste and food trends,1000000.0,2020
Pulse,Mumbai,FinTech,Helps people navigate through and profit off financial markets,750000.0,2020
Groww,Bangalore,FinTech,Leading Investment and Trading Platform,30000000.0,2020
i3 Systems,Mumbai,Insurance Tech,Transforming India's health insurance industry with its digital solutions and AI products for automation,1050000.0,2020
SOAL,Mumbai,EdTech,"A skill-tank nurturing students into disruptive, tech-empowered creators and future leaders",1000000.0,2020
OckyPocky,Gurgaon,EdTech,Ockypocky helps kids in learning spoken english,400000.0,2020
Hippo Video,New York,Video personalization,Helps enterprise businesses achieve their marketing and sales goals through seamless video,4000000.0,2020
Hasura,San Francisco,Software Company,"Builds developer tooling products, including open source tools, backend",25000000.0,2020
Qapita,Singapore,FinTech,Qapita provides digital equity management tools for private companies and startups.,1080000.0,2020
Sunday,Bangkok,FinTech,An end-to-end insurance products and services provider that uses AI to offer personalized packages.,9000000.0,2020
Gamezop,Gurgaon,Gaming,A multi-game platform,4300000.0,2020
Phool.co,Kanpur,Biomaterial startup,They use flowers from temples across India's and create useful products such as rose incense cone,1400000.0,2020
Chiratae Ventures,Bangalore,Venture capital,A leading tech venture capital fund focused on enabling entrepreneurs in India.,1.0,2020
MedLife,Bangalore,Health,"An India online platform, which provides pharmacy, diagnostics, and e-consultation in India.",6800000.0,2020
IDfy,Mumbai,IT,IDfy provides risk and fraud solutions,2110000.0,2020
True Balance,Gurgaon,Finance,Earn money by meeting financial needs of your friends and neighbors.,28000000.0,2020
Bira91,Delhi,Craft Beer,A craft beer brand manufactured by B9 Beverages Pvt. Ltd.,764000.0,2020
Max wholesale,Delhi,E-commerce,MaxWholesale is an online distributor that provides authentic FMCG goods,603000.0,2020
Craftsvilla,Mumbai,E-commerce,"Sells ethnic apparel, footwear, fashion accessories, beauty products, handcrafted home accessories",409000.0,2020
MechMocha,Bangalore,Entertainment,India's first vernacular social gaming platform,292000.0,2020
Mindhouse,Gurgaon,Healthtech,A gym to train your mind offering workouts and programmes,286000.0,2020
DeepSync,Chandigarh,AI startup,"A revolutionary way to record your content, without you really speaking",136000.0,2020
Eruditus,Mumbai,Education,Bring world-class business and professional education to a global audience,825000000.0,2020
Gradeup,Noida,Education,"India's largest exam preparation destination,",546000.0,2020
Tracxn,Bangalore,Investment,Tracxn is the research partner for Venture Capitalist,887000.0,2020
Purple Style Labs,Mumbai,Fashion,Shopping experience and foster the growth of Indian brands and designers.,43000.0,2020
ProPhysio,Bangalore,Health,The largest provider of physiotherapy and rehabilitation services,40900.0,2020
Flickstree,Mumbai,Tech,World's largest video publisher,40900.0,2020
Settl,Gurgaon,TravelTech,Get affordable AC bus-rides everyday,1.0,2020
Fanspole,Thane,Entertainment,India's only social fantasy gaming platform,1.0,2020
Sarva,Mumbai,Healthcare,A wellness ecosystem built on the authentic foundations of Yoga,1.0,2020
Univ.ai,Bangalore,EdTech,"A distributed, global educational powerhouse that draws on technology",1.0,2020
PurohitJi,Bangalore,Linguistic Spiritual,App for Hindu Puja Products & Services,1.0,2020
CredoLab,Singapore,Tech,AI credit scoring platform,7000000.0,2020
Brick&Bolt,Bangalore,Construction,"A construction company doing house construction, building construction, commercial construction",2200000.0,2020
Grinntech,Chennai,Battery manufacturer,Leading on all fronts of battery design,2000000.0,2020
6Degree,Mumbai,Fashion,India's leading fashion business platform,340000.0,2020
Exprs,,Nano Distribution Network,"Nano Distribution Centres, enabling seamless connectivity of businesses & Consumers.",5660000.0,2020
Bikayi,Hyderabad,E-commerce,Provides free whatsapp integrated E-Commerce Store,2000000.0,2020
Virtual Forest,Bangalore,Tech,Tracking seasonal change in virtual forest,1.0,2020
The Health company,Gurgaon,AI health,Organic superfoods & free personal health coaching that actually work.,350000.0,2020
TrulyMadly Matchmakers,Gurgaon,Dating app,One of the best dating Apps in India connecting singles across the country.,110000.0,2020
TrueFan,Mumbai,Media,Enables users to play quizzes around celebrities and winners get a personalised video message from stars.,4300000.0,2020
Fanspole,Mumbai,Gaming,A free app that users can use to create contests and play,1.0,2020
Byju's,Bangalore,EdTech,Provides online learning classes,122000000.0,2020
Avail Finance,Bangalore,Fintech,Instant online loan app,11635000.0,2020
The Money Club,Delhi,AI,AI based chit fund cashier app,1.0,2020
Virohan,Gurgaon,Healthcare/Edtech,Healthcare training company,2800000.0,2020
OneCode,Gurgaon,Social Commerce,Connects new-age digital first brands with relevant sellers,1.0,2020
Verloop.io,,AI,Helps automate customer service using Artificial Intelligence,5000000.0,2020
Otipy,,Agritech/Commerce,Connects consumers with farmers thorugh women resellers,1000000.0,2020
Evage,Chandigarh,Mobility tech,Develop emissions-free electric commercial vehicles,1.0,2020
LEAD School,Mumbai,EdTech,Offers an integrated system for schools by helping them digitize the entire curriculum,28000000.0,2020
Trell,Bangalore,Social e-commerce,Allows users to share their travel experiences,11000000.0,2020
Captain Fresh,Bangalore,Food & Logistics,Sea food Supply chain,2300000.0,2020
Teachmint,Bangalore,EdTech,Empowers tutors with tools to deliver effective learning outcomes for students and parents,1.0,2020
Pixxel,Bangalore,SpaceTech,Indian Earth observation startup,5000000.0,2020
Habbit Health,Delhi,Nutrition Tech,Applies modern science for healthier life through proprietary foods & digital ecosystem,1.0,2020
SmarterBiz,Bangalore,Tech,An end-to-end CX platform enabled with the gig workforce,1065000.0,2020
Able Jobs,Bangalore,HR,Provides end to end hiring support to companies,2000000.0,2020
Vieroots,Kochi,Healthtech,Personalised lifestyle management using epigenetic science,1.0,2020
Stack Finance,Bangalore,Fintech,"It automates invesments, expenses, borrowing under a single platform",1.0,2020
FPL Technologies,Pune,Fintech,OneScore app is built by FPL - Free credit scoring and monitoring,10000000.0,2020
Masai School,Bangalore,EdTech,It trains tech aspirants in full stack wed and android development,2500000.0,2020
Mitron,Bangalore,Media,Short Video and Social Platform,5000000.0,2020
Daalchini,,IoT,Physical and Digital vending machines startup,669000.0,2020
Suno India,,Media,Multilingual podcast platform,1.0,2020
LendingKart,Ahmedabad,Fintech,Provides working capital loans and business loans to MSMEs,16076000.0,2020
Text Mercato,Bangalore,,Cataloguing startup that serves ecommerce platforms,649600.0,2020
Eden Smart Homes,,IoT,Develops smart home automation systems,1.0,2020
GrayQuest,Mumbai,EdTech,Enables parents to pay their annual education fees in up to 12 monthly installments,1000000.0,2020
BigHaat,Bangalore,Agritech,Agri-inputs ecommerce player,2000000.0,2020
CityCash,Mumbai,Fintech,Focusses on creating a transit led micro-payments ecosystem,1000000.0,2020
HomeLane,Chennai,Interior design,Provides interior designing solutions,1000000.0,2020
HungerBox,Bangalore,Foodtech,"Offers B2B tech platform to corporates, aimed at improving the operations of their cafeterias",6700000.0,2020
DaveAI,Bangalore,AI,Sales augmentation platform with a vision to democratise AI for enterprises,1.0,2020
Eduvanz,Mumbai,Fintech,Digital finance NBFC that provides affordable education loans,5000000.0,2020
ZipLoan,Delhi,Fintech,Provides loans to MSMEs,2000000.0,2020
DocSumo,Mumbai,AI,Platform helps to automate and analyse financial data,220000.0,2020
CUSMAT,Warangal,AR/VR,It builds high immersion training systems for enterprises,1.0,2020
Chingari,Bangalore,Media,Short video platform,1300000.0,2020
Bolo Indya,Gurgaon,Media,User-generated content platform,300000.0,2020
Data Sutram,Kolkata,AI,Platform gathers intel from external data to provide location-based data intelligence.,266500.0,2020
Wobot Intelligence,Delhi,AI,AI backed video analytics platform,2500000.0,2020
DrinkPrime,Bangalore,Appliance,Subscription-based Water purifier startup,2879000.0,2020
Infeedo,Gurgaon,HR tech,An employee engagement HR analytics platform,700000.0,2020
Probus Smart Things,Delhi,IoT,Platform for monitoring distribution sub-station performance and operations,1.0,2020
CrowdPouch,Bangalore,Tech,A reward-based fundraising and preselling platform,1.0,2020
Rebel Foods,Mumbai,Food tech,Cloud kitchen platform,26500000.0,2020
Hevo,Bangalore,Tech,Data pipeline startup,8000000.0,2020
BigSpoon Foods,Ahmedabad,Foodtech,Cloud kitchen startup,2000000.0,2020
Chingari,Bangalore,Media,Homegrown short video platform,1000000.0,2020
ShareChat,Bangalore,Media,Indian social network platform,351000.0,2020
DatStop,Delhi,Hospitality,It offers urban social space,1.0,2020
IPHM Services,Mumbai,Mental Health,It helps design programs and workshops for the psychological well-being of individuals,1.0,2020
Wellcure,Gurgaon,Healthtech,It caters to all health and wellness needs,200000.0,2020
VilCart,Bangalore,Ecommerce,"Retail industry in rural India through technology, supply chain, and logistics facilities.",1.0,2020
Firescore,Mumbai,Gaming,Game development studio,500000.0,2020
BulBul,Gurgaon,Social commerce,A video and livestream led commerce platform that makes online shopping engaging,8700000.0,2020
Toppr,Mumbai,Edtech,It provides AI-based after school learning app for K12,46761000.0,2020
Pickright Technologies,Bangalore,Fintech,Marketplace for stock market investors and advisors,175000.0,2020
Muse Wearables,Chennai,Tech,It sells the world’s first payment-enabled hybrid smartwatches,3000000.0,2020
SATYA Microcapital,Delhi,Fintech,Microfinance company that offers collateral-free credit to micro enterprises,9.6,2020
WYN Studio,Gurgaon,Media,It creates video content and podcasts,1.0,2020
Fourth Partner Energy,Bangalore,Solar Solution,Largest startup in the distributed solar sector,15000000.0,2020
Entri,Kochi,Edtech,Local language learning startup,1700000.0,2020
Snack Amor,Mumbai,Foodtech,Healthy snack startup,1.0,2020
MPowered,Gurgaon,SaaS,Asset Management Solutions,21000000.0,2020
Leap Club,Gurgaon,Social e-commerce,Community led professional network for women,1.0,2020
Ather Energy,Bangalore,Automobile,Electric scooter manufacturer,11241000.0,2020
Gigforce,Bangalore,HR tech,Provides staffing solutions for businesses,804000.0,2020
Vegrow,Bangalore,Agritech,It is building an asset-light farm by partnering with small farms on a profit-sharing model,2500000.0,2020
Finn,Bangalore,Fintech,Neobanking startup that digitises all banking transactions,1.0,2020
Bijnis,,B2B marketplace,Provides a platform for manufacturers and retailers in digital transaction,10000000.0,2020
iNurture,Bangalore,Edtech,"It provides a conducive and healthy teaching, learning environment",1340000.0,2020
StyleDotMe,Gurgaon,Fashion Tech,"mirrAR, helps jewellers sell jewellery with no physical inventory",467000.0,2020
Ripsey,Mumbai,Nutrition tech,It plans meals in consultation from fitness experts and nutritionists and prepares them in-house,133000.0,2020
ThriveFNC,Pune,Health & Wellness,Focusses on reversing chronic lifestyle disorders through functional nutrition.,1.0,2020
Vedantu,Bangalore,Edtech,Onine learning platform,100000000.0,2020
Magicpin,Gurgaon,,"It is a local discovery, rewards, and commerce platform",7000000.0,2020
Procol,Delhi,Agritech,Commodity procurement platform,3823000.0,2020
Yumlane,Mumbai,Cloud Kitchen,Online retailer that offers a range of on-the-go hot snacking and meals,1000000.0,2020
Crio,Bangalore,Edtech,A learning platform for developers,934000.0,2020
Openapp,Bangalore,IoT,Security solutions startup,500000.0,2020
PumPumPum,Gurgaon,IoT/Automobile,Offers leased car services,293000.0,2020
uFony Services Pvt ltd,Pune,Edtech,"School Diary, a platform that brings education to smartphones",1.0,2020
Protinus Fashion Networking Pvt Ltd,Mumbai,Fashion,Owns and operates fashion commerce and retail management platform 6Degree,1.0,2020
Uable,Bangalore,Edtech,Online life skills development platform for children,1.0,2020
ParkSmart,Delhi,IoT,Parking spot reservation platform,198000.0,2020
Plum,Bangalore,Healthtech,Provides health benefits to corporates,927000.0,2020
IncNut Digital,Hyderabad,Ecommerce,Owns and Operates two women-centric digital media platforms -- Stylecraze.com and Momjunction.com,4000000.0,2020
GigIndia,Pune,Tech,Marketplace that provides on-demand work completion for companies through workforce of jobseekers,971000.0,2020
Specsmaker,Chennai,Eye Wear,Online optical chain for eye wears,3060000.0,2020
Piggy Ride,Bangalore,SaaS,"Offers parents and kids, a platform to browse and book extracurricular interest-based activities",1862000.0,2020
Chai Waale,Chennai,Beverage,Tea Brand,232000.0,2020
NOTO,Mumbai,Food,A brand that makes healthy icecream,1.0,2020
Cuemath,Bangalore,Edtech,It helps students to learn math online,2888000.0,2020
Cars24,Gurgaon,Automobile,Online platform for selling used cars,1328000.0,2020
JetSynthesys,Pune,Digital tech,Digital entertainment and technology company,40000000.0,2020
Earth Energy EV,Mumbai,Automobile,Electric vehicles startup,1.0,2020
Green Cure,Delhi,Health & Wellness,It sells herbal OTC products,1.0,2020
Blue Sky Analytics,Gurgaon,Data Intelligence,"It is building AI-powered infrastructure to analyse air quality, pollution etc",1200000.0,2020
Edhusk,Jaipur,Edtech,Provieds personalised learning to students by leveraging technology-driven models,1.0,2020
Decentro,Bangalore,Fintech,Automated API-based platform that enables financial integrations.,15500000.0,2020
Zolostays,Bangalore,Co-living,It offers affordable housing apartments to young professionals and students,56000000.0,2020
Frontier Markets,Jaipur,Ecommerce,Women entreprenuers sells products and services to rural India,2250000.0,2020
Brainwired,Kerala,Agritech,India’s first livestock health monitoring company,1.0,2020
Aye Finance,Gurgaon,Fintech,A finance lender to SMEs,16753000.0,2020
Paper Boat,Gurgaon,Food & Beverages,Ecommerce platform for beverages and snacks,3700000.0,2020
Ken42,Bangalore,Edtech,A platform that caters to evolving needs of institutions,1470000.0,2020
Forbidden Foods,Delhi,Food,Packaged snacks company,1000000.0,2020
Universal Sportsbiz,Bangalore,Fashion,Indian fashion industry with on-trend products,530000.0,2020
Gobbly,Gurgaon,Retail Tech,A contactless retail store filled with fruits and veggies,500000.0,2020
Aerostrovilos,Chennai,Automotive,Manufactures micro gas turbines for power-based application,1.0,2020
Mitron,Bangalore,Media,Short Video and Social Platform,267000.0,2020
Bulk MRO,Mumbai,B2B,A full stack B2B platform for industrial supplies,3344000.0,2020
Inspektlabs,Delhi,AI,Focuses on building computer vision products for physical asset inspections,600000.0,2020
Big Bang Boom Solutions,Chennai,Defense tech,It developed integrated intellectual properties for defense,1000000.0,2020
Flinto,Chennai,Edtech,It is an educational subscription-box focussed at activity-based learning for the ages 2-12,7200000.0,2020
Zetwerk,Bangalore,Marketplace,B2B marketplace that connects manufacturing companies for industrial equipements,21000000.0,2020
ChitMonks,Hyderabad,Fintech,Offers enterprise private platform for chit fund firms,650000.0,2020
Walrus,Bangalore,Fintech,It provides banking solutions for teens and young adults,1.0,2020
Arth Designbuild,Hyderabad,Construction tech,Construction technology and solutions provider,1100000.0,2020
goDutch,Mumbai,Fintech,Group Payments platform,1700000.0,2020
Rusk Media,Delhi,Digital Media,It creates video content,1.0,2020
Bold Care,Mumbai,Health & Wellness,Digital platform that offers sexologist consultations for  men,1.0,2020
Samosa Party,Bangalore,Food,Provides quality Indian Snacks,1.0,2020
High Street Essentials,Delhi,Ecommerce,The parent company of women's fashion brands FabAlley and Indya,2743000.0,2020
Byju's,Bangalore,Edtech,Provides online learning classes,1.0,2020
Slice,Bangalore,Fintech,A financial platform for youngsters,6082000.0,2020
Bombay Play,Bangalore,Gaming,It designs and creates online multiplayer games,1500000.0,2020
Fullife,Mumbai,Healthtech,It sells sports nutrition supplements through a brand called Fast&Up,6609000.0,2020
Oziva,,Nutrition,Clean Label Active Nutrition Brand,5000000.0,2020
Aye Finance,Gurgaon,Fintech,A finance lender to SMEs,27700000.0,2020
Aether Biomedical,Delhi,Medtech,"Medical robotics startup, focussed on developing rehabilitation devices",1.0,2020
91springboard,Delhi,Coworking,It offers collaborative workspace with varied amenities,5940000.0,2020
Yulu,,Micro-mobiity,The electric and scooter rental startup,3964000.0,2020
Milkbasket,Gurgaon,Logistics,Hyperlocal delivery service startup,5500000.0,2020
MergerDomo,Noida,Marketplace,Global online corporate deal sourcing and consulting marketplace,197000.0,2020
GoMechanic,Delhi,Auto-tech,Find automobile repair and maintenance service providers,1.0,2020
Milk Mantra,Odisha,Food,Produces Dairy Products,10000000.0,2020
