Company/Brand,HeadQuarter,Sector,What it does,Amount($),Funding Year
Myglamm,Mumbai,Beauty,On-demand beauty services provider,4327000.0,2020
Drishti Technologies,Bangalore,AI,"AI-based video analytics, data, and insights bring benefits to manufacturers",25000000.0,2020
Instasolv,Noida,Edtech,It is a doubt-solving app for students from Class 6 to 12,2000000.0,2020
GoldenPi,Bangalore,Fintech,An online aggregator of bonds and debentures available in the secondary market,459000.0,2020
Peppermint,,Robotics,Industrial robotics startup,1.0,2020
Sarva,Mumbai,Yoga & wellness,It drives a cultural change in making yoga-based wellness a part of modern lifestyle,1.0,2020
Jai Kisan,Mumbai,Fintech,A platform that caters the need of customers in rural areas,3937000.0,2020
Agro2o,Delhi,Agritech,It develops products focused on making hydroponics-based farming,1.0,2020
LetsTransport,Bangalore,Logitech,Offers techno logistics solutions,1313500.0,2020
GabbarDeals,Pune,Ecommerce,Online-to-Offline platforms for mobile phones & accessories,1.0,2020
Crimson Healthcare,Delhi,Med Tech,It innovates cutting edge solutions for various problems in the healthcare system,229800.0,2020
Biomoneta,Bangalore,Life sciences,It develops germicidal technologies,1.0,2020
Edvizo,Bangalore,Edtech,"Online marketplace to search, compare and enrol in the best institutes for competitive exam preparation",150000.0,2020
Servify,Mumbai,SaaS,Operates device management and support platform,11370000.0,2020
Drum Food,Mumbai,Food,It runs yoghurt brand Epigamia,5305000.0,2020
Innoviti,Bangalore,SaaS,Digital payments solutions company,1.0,2020
Jiffy ai,,AI,Enterprise automation startup,18000000.0,2020
Postman,,Tech,API development platform startup,150000000.0,2020
F5,,Retail Aggregator,It provides opportunities for its partner vendors to upsell and cross-sell their products.,1.0,2020
Waycool,Chennai,Agritech,Food development and distribution services,5500000.0,2020
Myelin Foundry,,Deep Tech AI,"It builds AI based algorithms on video, voice and sensor",1.0,2020
Ameliorate Biotech,Bangalore,Biotech,"Their products address the needs in Early Stage Diagnostics, Bio-Similars and Nutraceuticals.",264000.0,2020
Hapramp,Gurgaon,Blockchain,Startup working on technologies like blockchain and social media,1000000.0,2020
MyKaam,Bangalore,HrTech,Online job searching and recruiting platform,1.0,2020
HealthPlix,Bangalore,Healthtech,It provides clinical software for doctors,6000000.0,2020
YoloBus,Gurgaon,Mobility/Transport,Intercity bus service startup,3300000.0,2020
iNurture Education,,Edtech,"It provides a conducive and healthy teaching, learning environment",4000000.0,2020
Pocket52,Bangalore,Gaming,An online poker playing platform,1750000.0,2020
QuaQua,Hyderabad,Travel,Virtual travel guide platform,1000000.0,2020
Crofarm,Delhi,Agritech,Supply chain that supports farmers and provides businesses with freshest produce,1000000.0,2020
Timios,Bangalore,Foodtech,Provides healthy snacks for kids,1.0,2020
Wooden Street,Jaipur,Ecommerce,It enables to order custom furniture online,3000000.0,2020
BankBazaar,Chennai,Fintech,Online marketplace that gives customers instant customised offers on loans and credit cards,5967000.0,2020
Rentmojo,Bangalore,Rental,"Rental platform for furniture, appliances & electronics",2980000.0,2020
Credgencies,,AI & Debt,Tech-enabled platform for resolution of non-performing assets,1.0,2020
Knorish,Delhi,SaaS/Edtech,All-in-one knowledge commerce SaaS platform,323000.0,2020
LetsTransport,Bangalore,Logitech,Offers techno logistics solutions,1326000.0,2020
Vahak,,Transport,It enables logistic companies to conncet with transporters,1.0,2020
Nutrova,Mumbai,Nutrition,"Nutraceutical company developing evidence-based nutrition and nutraceutical products,",1.0,2020
Cube Wealth,Mumbai,SaaS,A digital wealth management services,500000.0,2020
IVF Access,Bangalore,Healthtech,It provdes IVF treatments,5000000.0,2020
Hoi Foods,Delhi,Foodtech,Quality food solution,2000000.0,2020
Ola Financial Services,Bangalore,Fintech,It operates Ola Money,27000000.0,2020
Awifs,Delhi,Co-working,Provides office space solutions,5200000.0,2020
Dunzo,Bangalore,Logistics,India-based hyperlocal delivery startup,55000000.0,2020
Swiflearn,Gurgaon,Edtech,Learning platform for K-10 students looking for personalised learning,1.0,2020
Remedo,Delhi,Healthtech,The platform connects doctors with patients,1.0,2020
Blowhorn,Bangalore,Logistics,Tech platform that connects logistics service seekers with mini-truck drivers,1.0,2020
Toch,Mumbai,AI,"Helps online video creators, media companies, advertisers, and OTT platforms optimise their videos",1000000.0,2020
Gram Cover,Noida,Insurtech,It provides insurance products in rural areas,1.0,2020
Coin DCX,Mumbai,Cryptocurrency,Hybrid crypto exchange platform,2500000.0,2020
HomeCapital,Mumbai,Fintech,Home Down Payment Assistance Program,1.0,2020
Euler Motors,Delhi,Automotive tech,Startup focusses on electric vehicles,2530000.0,2020
Riskcovry,Mumbai,Insurtech,Offers various insurance products,1.0,2020
NWNT (No Worry No Tension Healthcare),Delhi,Healthtech,Mental healthtech startup,1.0,2020
Voicezen,Gurgaon,AI,Conversational AI startup,1.0,2020
Leap Club,Gurgaon,,Community led professional network for women,340000.0,2020
Credit Mantri,Chennai,Fintech,Offers free credit score and a detailed credit analysis report,792000.0,2020
Xtracap,Gurgaon,Fintech,"Offers online payment solution,schemes, order management, insurance etc.,",1000000.0,2020
Tring,Mumbai,Media,Celebrity engagement platform,1.0,2020
Vakilsearch,Chennai,Legal,"Online platform for legal, tax and compliance services",1.0,2020
Khatabook,Bangalore,Fintech,It helps SMEs to maintain their accounts and ledger online.,60000000.0,2020
LendingKart,Ahmedabad,Fintech,Provides working capital loans and business loans to MSMEs,11363000.0,2020
Illumnus,,Edtech,Offers Collaborative learning management system for educational institutions,100000.0,2020
LetsTransport,Bangalore,Logitech,Offers techno logistics solutions,1715000.0,2020
Eggoz,Bihar,Agritech,"Provides technology backed, deep integration services to egg farmers",329000.0,2020
Winuall,Bangalore,Edtech,It helps coaching institutes in digitization,1.0,2020
Indian School Finance Company,Hyderabad,Fintech,NBFC that provides funding to education system,5271000.0,2020
Juicy Chemistry,,,It focuses on organic based skincare products,650000.0,2020
DeepTek,Pune,Healthtech,AI enabled radiology platform,1.0,2020
Stepathlon Lifestyle,Mumbai,Fitness,It organises corporate wellness programs,1.0,2020
Sindhuja Microcredit,Noida,Fintech,It provides financial services to self employed women entrepreneurs,8700000.0,2020
Rentmojo,Bangalore,Rental,"Rental platform for furniture, appliances & electronics",3226000.0,2020
Tesco Charge Zone,Gujarat,EV,Operates electric vehicle charging zone,1.0,2020
Intello Labs,Gurgaon,"Supply chain, Agritech",Standardisation and Quality control of fruits & vegetables,5900000.0,2020
SirionLabs,Gurgaon,SaaS,"Provides procurement, outsourcing services & contract management software",44000000.0,2020
Magicpin,Gurgaon,,"It is a local discovery, rewards, and commerce platform",3879000.0,2020
GroCurv,Gurgaon,B2B,"It offers a wide range of business related services like Branding, marketing, sales etc.,",1.0,2020
Refrens,Bangalore,SaaS,"Offers a free invoicing, payments and expense management system",1000000.0,2020
Shiprocket,,Logitech,Tech enabled logistics aggregator,13000000.0,2020
Spyne,Gurgaon,AI,Helps online businesses with visual content,1.0,2020
Nykaa,Mumbai,Ecommerce,Deals in cosmetic and wellness products,8800000.0,2020
Docsapp,Bangalore,Healthtech,Online doctor consultation app,9500000.0,2020
Phable,,Healthtech,"It creates an engagement loop between doctors, hospitals, and patients via its app",1000000.0,2020
Generic Aadhaar,,Pharma,It provides a platform for entrepreneurs to access generic  medicine at low cost,1.0,2020
Nium,,Fintech,Open global money platform,1.0,2020
Mintoak,Mumbai,Fintech,Merchant payment solutions startup,2000000.0,2020
VestSpace,Pune,Spacetech,It builds small satellite paltforms,10000000.0,2020
Blackbuck,Bangalore,Logistics,Provides trucking services,1.0,2020
Vernacular ai,Bangalore,AI,It offers Multiligual AI platform,5100000.0,2020
Clover,Bangalore,Agritech,Provides agricultural solution to farmers working in the greenhouse production of vegetables and fruits,920000.0,2020
Varthana,Bangalore,Fintech,Offers secured and unsecured loans,15000000.0,2020
Codeninja,Bangalore,SaaS,AI-powered 'no-code' platform which can generate application development code,1.0,2020
MetaMerphoSys,Pune,Insurance technology,Digital insurance platform for businesses,1.0,2020
Rooter,Delhi,Gaming,Live sports engagement platform,1700000.0,2020
Aker Foods,Pune,Foodtech & Logistics,Ai driven supply chain platform,1.0,2020
Sascan Meditech pvt ltd,Kerala,Healthtech,They are developing technology that can detect early cancerous cells,1.0,2020
DailyHunt,,Media,News aggregator,35600000.0,2020
Pratilipi,Bangalore,Media,A digital platform that connects readers and writers in various languages,9400000.0,2020
Biryani By Kilo,Delhi,Food,Online paltform to order biryani,790000.0,2020
Consure Medical,Delhi,Healthtech,"Novel platform technologies to manage, diagnose, and treat various GI disorders",480000.0,2020
Servify,Mumbai,,It is a technology company which serves as a platform for brands to offer end-to-end solutions to their users,250000.0,2020
Tessol,Mumbai,Logistics,It provides end to end cold chain logistics solutions,160000.0,2020
Remedo,Noida,Healthtech,"It helps doctors engage with patients, improve patient experience",1.0,2020
News Reach,Ahmedabad,Media,"It is a platform that digitalises local newspaper publishers, reporters, stringers by aggregating their content",1.0,2020
RoomSoom,Noida,Housing,It provides co-living and student rooms,1.0,2020
Pedagogy,,Edtech,It has a single subscription model that allows users to access books and digital courses.,400000.0,2020
Classplus,Delhi,Edtech,"It provides mobile-first software for coaching institutes, tuition centres and private tutors",8200000.0,2020
Medlife,Bangalore,Pharmaceutical,It solves inadequacies in the healthcare delivery system through technology,15500000.0,2020
Qin1,Noida,Edtech,It is alearning platform for kids in the age group 5 to 14 yrs,1.0,2020
MYSUN,Delhi,Tech,Platform for rooftop solar energy solutions,4257000.0,2020
ShopX,Bangalore,Ecommerce,B2B retail operating system,1410000.0,2020
Sarva,,Yoga & wellness,It drives a cultural change in making yoga-based wellness a part of modern lifestyle,1.0,2020
Expertrons,Mumbai,AI,AI video bot platform for career hacks,1.0,2020
NewsBytes,Gurgaon,Digital Media,News portal,1500000.0,2020
Wagonfly,Bangalore,,Contactless shopping and delivery experience by using radio frequency to tag retail items,500000.0,2020
NIRA,,Fintech,It offers access and credit to working Indians,2100000.0,2020
Convosight,Hyderabad,Data Analytics,It helps business gain insights from its community on Facebook groups,4000000.0,2020
Fittr,Pune,Fitness,Fitness Social Network & Consultation Platform,2000000.0,2020
AsknBid,Bangalore,Investment Tech,It builds algorithmic investing-based tech products,1.0,2020
Bira91,Bangalore,Beverage,Craft beer maker,20000000.0,2020
Finaureus Technologies,Pune,Fintech,Provides investment management solutions,1.0,2020
Daily Ninja,Haryana,Ecommerce,Online Milk Delivery startup,349800.0,2020
Guvi Geek Network Pvt Ltd,Chennai,Edtech,Operates vernacular-language based education,786000.0,2020
LoadShare,Bangalore,Logistics,Provides technology based solutions to SMEs in logistics,2004000.0,2020
Vedantu,Bangalore,Edtech,Onine learning platform,6800000.0,2020
Indusface,,IT,It provides IT security solutions,5000000.0,2020
DMI Group,Delhi,Financial Services,Pan-India Credit providing platform,123000000.0,2020
Spintly,Goa,IoT,It is a wireless cloud-based access control system,248000.0,2020
Credr,Mumbai,Automobile,A marketplace to buy and sell used bikes and scooters,1.0,2020
Bijak,Gurgaon,Agritech,"It is a platform that gives agricultural commodity at better prices, increased working capital, and optimised logistics",12000000.0,2020
Bugworks,Bangalore,Biopharma,A drug discovery company that aims to discover novel treatment options for resistant bacterial infections,7500000.0,2020
DrinkPrime,Bangalore,,Water purifier subscription service,1.0,2020
Yap,Chennai,Fintech,Banking and payment products-focused API platform,4500000.0,2020
UzhavarBumi,Tamil Nadu,Dairy,Provides fresh dairy products,1.0,2020
Tattva,Delhi,Beauty & wellness,Sells its organic and beauty products via marketplace,150000.0,2020
Pariksha,Pune,Edtech,Platform for vernacular test-preparation,1.0,2020
DailyHunt,,Media,News aggregator,24000000.0,2020
NoBroker,Bangalore,Real Estate,Online real estate rental startup,30000000.0,2020
Box8,Mumbai,Foodtech,Enables to order food online,4000000.0,2020
Capital Float,Bangalore,Fintech,Online platform that provides working capital finance to SMEs,15000000.0,2020
ITILITE,Bangalore,Travel & SaaS,Platform for business travel,13000000.0,2020
Morning Context,,Digital Media,A subscription-only digital media publisher,1.0,2020
Aavenir,Ahmedabad,SaaS,Source-to-Pay Software,2000000.0,2020
Savvy Co op,,Healthcare,It connects patients with healthcare companies,1.0,2020
BLive,,Tourism & EV,"It offers experiential, guided tours on smart electric bikes",1.0,2020
Yellow Messenger,Bangalore,AI,It offers conversational chatbots,20000000.0,2020
Toch,,Media Tech,AI based Video object detection and Tagging platform,400000.0,2020
Ewar,Bangalore,Gaming,E-sports and real-time gaming startup,200000.0,2020
Setu,,Fintech,"Offers open APIs across four categories: bills, savings, credit, and payments.",14259000.0,2020
Wellthy Therapeutics,Bangalore,Healthtech,It offers a digital therapeutics service,4000000.0,2020
Power Gummies,Delhi,Health,Offers health supplements related gummies,1.0,2020
Locale ai,Bangalore,Location Analytics,It helps companies with moving assets  increase revenues and demand using real time location data and analytics,1.0,2020
FarEye,Delhi,Logistics,"It enables businesses to execute, track, predict and oprimize the movements of goods",24500000.0,2020
Rebel Foods,,Food tech,It runs internet kitchen,50000000.0,2020
BankBazaar,Chennai,Fintech,Online marketplace that gives customers instant customised offers on loans and credit cards,3800000.0,2020
Porter,Mumbai,Logistics,Logistics and fleet management,18370000.0,2020
SugarBox,Mumbai,Tech,Hyperlocal data distribution platform,68525000.0,2020
Capital Float,Bangalore,Fintech,Online platform that provides working capital finance to SMEs,4800000.0,2020
Big Basket,Bangalore,E store,Online grocery store,60000000.0,2020
Amica,,Fintech,Neobanking startup,2000000.0,2020
Vedantu,Bangalore,Edtech,Onine learning platform,12500000.0,2020
Fingerlix,,Food,"It provides ready-to-cook products such as batters, mixes, curries, dals, parathas etc.,",1834000.0,2020
Plop,Mumbai,Tech,It Provides an interactive fiction entertainment platform to entertain & educate Gen Z & Millennials in a language they understand,1.0,2020
Zupee,,Gaming,It runs live quiz tournaments on its app.,8000000.0,2020
DeHaat,,Agritech,Online marketplace for farming services and products,12000000.0,2020
Lido Learning,Mumbai,Edtech,Online teaching service,7500000.0,2020
Aye Finance,Gurgaon,Fintech,A finance lender to SMEs,23850000.0,2020
Swiggy,Bangalore,Foodtech,Platform to order food online from restaurants and getting it delievered,43000000.0,2020
Akna Medical,,Healthtech,Provides supply solutions for surgical and pharmaceutical products.,7000000.0,2020
Zomato,Gurgaon,Foodtech,Online food delivery and restaurant discovery platform,5000000.0,2020
RaRa Delivery,,Logistics,Provides same day delivery service for ecommerce businesses,800000.0,2020
JusPay,Bangalore,Fintech,Online payment solutions,21600000.0,2020
Obviously AI,,Data Science,It provides predictive insights to clients by leveraging their data,1.0,2020
Fingpay,Mumbai,Fintech,Provides payment solutions,3500000.0,2020
Recko,Bangalore,SaaS,The platform enables AI-powered reconciliation of digital transactions,6000000.0,2020
Furlenco,Bangalore,Ecommerce,Furniture rental startup,10000000.0,2020
Mera Cashier,Noida,Fintech,App meant for small and micro businessmen to manage their transactions digitally,150000.0,2020
Kitchens Centre,Delhi,,Offers solutions to cloud kitchens by providing commercial space and kitchen infrastructure to assisting with branding and other services,500000.0,2020
Camp K12,Gurgaon,Edtech,It connects students with tutors online,4000000.0,2020
MedGenome,Bangalore,Healthtech,Genetic diagnostic testing company,55000000.0,2020
Ergos,Bangalore,Agritech,It enables farmers to digitise their foodgrain and also provide access to supply chain solutions,4598000.0,2020
Nykaa,Mumbai,Ecommerce,Deals in cosmetic and wellness products,13137000.0,2020
Samadhan,Delhi,Insurance,They help find solutions to insurance related issues,1.0,2020
SaScan,Bangalore,Healthcare,Cancer diagnostics startup,1.0,2020
Lido Learning,Mumbai,Edtech,Online teaching service,3000000.0,2020
CureFit,Bangalore,Health and Fitness,"Integrated platform for food, fitness and meditation.",115000000.0,2020
Nimesa,Bangalore,SaaS,Cloud data managemnt solutions enterprise,1.0,2020
Design X,Noida,IoT,Builds IoT based products,200000.0,2020
Driftly Electric,Bangalore,Automobile,Electric vehicle startup,1.0,2020
Imstrong,Bangalore,Fitness,It is an online and live video-streaming platform that allows trainers and fitness enthusiasts to connect and engage in interactive online classes.,400000.0,2020
Craftsvilla,Mumbai,Marketplace,Online marketplace for ethnic wear,3900000.0,2020
Rupifi,Bangalore,Fintech,Offers financial products for SMEs,1.0,2020
SnackAmor,Mumbai,Food,It offers various healthy snacks,1.0,2020
Zealthy,Bangalore,Healthtech,"It connects women to healthproviders for specialities like infertility, maternity etc.,",1.0,2020
CoinDCX,,Fintech,A cryptocurrency trading platform,3000000.0,2020
NuNu TV,,Media,Kids-focussed Youtube channel,670000.0,2020
QTalk,Bangalore,Technology,Smart Phone Dialer,1600000.0,2020
Shadez,Mumbai,Interior & decor,Paint Company,100000.0,2020
Excess2Sell,Mumbai,Ecommerce,B2B Marketplace for Overstock & Surplus Inventory,1000000.0,2020
Stanplus,Hyderabad,Healthtech,Ambulance service,1500000.0,2020
Pitstop,Bangalore,Automobile,Doorstep car service,2500000.0,2020
Univariety,Hyderabad,Edtech,Online marketplace that provides career counselling and college guidance,1100000.0,2020
Peel Works,Mumbai,SaaS,E-commerce for corner/retail stores.,42.23,2020
CoreStack,Chennai,Technology,Enterprise cloud governance technology startup,8500000.0,2020
Vivriti Capital,Chennai,Fintech,Digital lending startup,50000000.0,2020
Agnikul,Chennai,Spacetech,"It designs, fabricates, tests and launch orbital class launch vehicles",3148000.0,2020
Fintso,,Fintech,Wealth management platform,2600000.0,2020
Khatabook,Bangalore,Fintech,It helps SMEs to maintain their accounts and ledger online.,1.0,2020
Smart Coin,,Fintech,Consumer lending startup,7000000.0,2020
ZunRoof,Gurgaon,Cleantech,"It specialises in solar rooftop design, installation, and management using technology",3000000.0,2020
Shop101,,Social e-commerce,Enables entrepreneurs to sell online,3900000.0,2020
OM Bhakti,Bangalore,FMCG,A puja cotton-wicks manufacturing startup,1.0,2020
Lal10,Uttar Pradesh,B2B,It helps Indian artisans and SMEs reach out to global retailers,1100000.0,2020
Anaxee Digital Runner,Indore,Tech,A tech-enabled ID verification and data collection startup,1.0,2020
CollegeKhabri,Bhopal,Edtech,Platform is an end-to-end college and career counselling platform for students,1.0,2020
Ola Electric,Bangalore,eMobility,Electric vehicle,1000000.0,2020
Multi Living,Mumbai,Real Estate,"It curates apartments from the homeowners, performs the quality check and offers the homes with built-in services to the potential tenants",6000000.0,2020
FamPay,Bangalore,Fintech,"It allows parents to send money to their kids below the age of 18, which they can spend securely under parent supervision.",4700000.0,2020
UnboxRobotics Labs,Bangalore,Automation tech,Automated flexible parcel sorting solutions for logistics providers,500000.0,2020
Karbon Card,Bangalore,Fintech,Specialisde corporate cards for startups,2000000.0,2020
Airmeet,Bangalore,Media & Networking,"A platform to host, discover, and attend fully remote events like conferences and professional meet-ups",3000000.0,2020
Innerchef,Gurgaon,Foodtech,Cloud kitchen platform,1000000.0,2020
Epigamia,Mumbai,FMCG,Flavoured and greek yoghurt brand,2558000.0,2020
StyleNook,Mumbai,Ecommerce,Marketplace for fashionable apparel,1.0,2020
Callido Learning,Mumbai,Edtech,Provides a structured educational approach to critical thinking and problem solving skills,1.0,2020
Soxytoes,Delhi,Ecommerce,Online store to buy various types of socks including funky and colorful socks,1.0,2020
F5,Delhi,E-market,Retail Aggregator,1.0,2020
Paper Boat,Bangalore,Food & Beverages,Ecommerce platform for beverages and snacks,4049500.0,2020
Strata,Bangalore,Proptech,Real estate investment platform,1500000.0,2020
Salesken,Bangalore,AI & Data science,Provides sales professionals with intelligence on various aspects of the sales pitch,8000000.0,2020
Arya,Noida,Agritech,Provides post-harvest services across the agricultural value chain,6000000.0,2020
Leap Finance,Bangalore,Fintech,Provides education loans to students based on the student’s future income,5500000.0,2020
Sleepy Owl,Delhi,Beverages,"It sells ready to drink cold brew coffees, brew boxes and packs.",1.0,2020
Tricog,Bangalore,Healthtech,Provides virtual cardiology services through its AI-powered healthcare platforms,10500000.0,2020
GogoBus,Delhi,Travel tech,Inter-City Mobility Startup,1.0,2020
Trell,Bangalore,Social e-commerce,Allows users to share their travel experiences,4000000.0,2020
Spaciya Consultants,Noida,Real Estate,Real estate consultancy firms,500000.0,2020
Bounce,Bangalore,Automotive and Rentals,Offers a variety of bikes and scooters that can be rented on a subscription basis,6500000.0,2020
Neeman,,Ecommerce,An eco-conscious footwear brand making comfortable shoes using Merino Wool,1000000.0,2020
Chqbook,Gurgaon,Fintech,"Marketplace for small business owners, offering them products around lending, credit cards etc",5000000.0,2020
SMEcorner,Mumbai,Fintech,Financial lending firm to SMEs,30000000.0,2020
Oda Class,Bangalore,Edtech,"It offers content and material via video, adopting a dual-teacher model with IIT and NIT alumni",1.0,2020
Spinny,Haryana,E-tail,Used car retailing platform,43700000.0,2020
goStops,Delhi,Accomodation,A premium chain of youth hostels catering to the millennials,1.0,2020
Umeed Housing,Haryana,Fintech,Housing finance company,23000000.0,2020
Vogo,Bangalore,Automotive,A scooter-sharing platform allowing users to rent a two-wheeler from specific designated pick up points,20000000.0,2020
Flick Stree,Mumbai,AI & Media,Artificial intelligence-based video publishing network,3000000.0,2020
Qure ai,Mumbai,Healthtech,Provides interpretations of radiology scans,16000000.0,2020
MinionLabs,Bangalore,Machine Learning,It leverages a Machine Learning-based approach to generate a comprehensive report on predictive analytics,1.0,2020
Josh Talks,Haryana,Media,Community of young individuals providing a platform to showcase their stories,1500000.0,2020
PhoneParLoan,Delhi,Fintech,Provides easy loans,1.0,2020
RailYatri,Noida,Travel,A complete Indian railways app,13800000.0,2020
AjnaLens,Thane,Deeptech,"It leverages technologies such as AR, VR & AI to offer hardware in areas such as education and defence",1500000.0,2020
Pepper,Mumbai,Content Marktplace,End to end content creation platform,306900.0,2020
Rupeek,Bangalore,Fintech,An asset backed online lending platform,30000000.0,2020
iMerit,Kolkata,IT,Turns information into data that is usable for machine learning processes,20000000.0,2020
BharatPe,Delhi,Fintech,Digital payments platform,75000000.0,2020
Invideo,,Visual Media,Video production and editing platform,2500000.0,2020
AvalonMeta,,Edtech,It combines higher education and competitive gaming,420000.0,2020
Near Store,Mumbai,Ecommerce,Enables a shop to create an online presence,300000.0,2020
ElecTorq,Delhi,Automobile,Electric vehicle startup,1.0,2020
Prayaan Capital,Chennai,Fintech,"NBFC that lends to micro, small, and medium-sized enterprises (MSMEs)",1200000.0,2020
Sanfe,Delhi,Hygiene,Women health care and wellness product,1100000.0,2020
Go Desi,Delhi,Foodtech,Provides traditional delicacies,627300.0,2020
Swiggy,Bangalore,Foodtech,Platform to order food online from restaurants and getting it delievered,113000000.0,2020
Whatfix,Bangalore,SaaS,"Digital adoption platform that helps companies provide intuitive onboarding, training and support",32000000.0,2020
Unacademy,Bangalore,Edtech,Platform that offers online education in India,110000000.0,2020
Zvesta,Gurgaon,Proptech,An online platform where users can search and buy properties listed by developers and brokers,5500000.0,2020
Dunzo,Bangalore,Logistics,India-based hyperlocal delivery startup,11000000.0,2020
Digit Insurance,Bangalore,Insurtech,General Insurance Company,340000.0,2020
Yolo,Gurgaon,Transport,Intercity transportation,600000.0,2020
SmartVizX,,VR & SaaS,It developed India’s first VR-based design communication and collaboration product Trezi,1397000.0,2020
MaxWholesale,Delhi,Ecommerce,B2B ecommerce platform for kirana stores,3000000.0,2020
Carbon Clean,,Cleantech,Develops affordable carbon capture technology,16000000.0,2020
Onsitego,,Sales & Services,It offers post-purchase services through a network of brand authorised service centres throughout the country,19000000.0,2020
Genius Corner,Noida,Edtech,Framework to enable personalised learning using artificial intelligence (AI) and machine learning (ML).,250000.0,2020
